paper_id,Title,Authors,Keyword,Abstract,Date,Field,Citations, 
52,Largescale Optimization of Partial AUC in a Range of False Positive Rates,Yao Yao Qihang Lin Tianbao Yang,Machine Learning (cs.LG); Optimization and Control (math.OC); Machine Learning (stat.ML),"  The area under the ROC curve (AUC) is one of the most widely used performancemeasures for classification models in machine learning. However, it summarizesthe true positive rates (TPRs) over all false positive rates (FPRs) in the ROCspace, which may include the FPRs with no practical relevance in someapplications. The partial AUC, as a generalization of the AUC, summarizes onlythe TPRs over a specific range of the FPRs and is thus a more suitableperformance measure in many real-world situations. Although partial AUCoptimization in a range of FPRs had been studied, existing algorithms are notscalable to big data and not applicable to deep learning. To address thischallenge, we cast the problem into a non-smooth difference-of-convex (DC)program for any smooth predictive functions (e.g., deep neural networks), whichallowed us to develop an efficient approximated gradient descent method basedon the Moreau envelope smoothing technique, inspired by recent advances innon-smooth DC optimization. To increase the efficiency of large dataprocessing, we used an efficient stochastic block coordinate update in ouralgorithm. Our proposed algorithm can also be used to minimize the sum ofranked range loss, which also lacks efficient solvers. We established acomplexity of $\tilde O(1/\epsilon^6)$ for finding a nearly $\epsilon$-criticalsolution. Finally, we numerically demonstrated the effectiveness of ourproposed algorithms for both partial AUC maximization and sum of ranked rangeloss minimization.    ",2022/03/03,Machine Learning,88,
53,Scalable Bayesian Optimization Using Vecchia Approximations of Gaussian Processes,Felix Jimenez Matthias Katzfuss,Machine Learning (cs.LG); Machine Learning (stat.ML),"  Bayesian optimization is a technique for optimizing black-box targetfunctions. At the core of Bayesian optimization is a surrogate model thatpredicts the output of the target function at previously unseen inputs tofacilitate the selection of promising input values. Gaussian processes (GPs)are commonly used as surrogate models but are known to scale poorly with thenumber of observations. We adapt the Vecchia approximation, a popular GPapproximation from spatial statistics, to enable scalable high-dimensionalBayesian optimization. We develop several improvements and extensions,including training warped GPs using mini-batch gradient descent, approximateneighbor search, and selecting multiple input values in parallel. We focus onthe use of our warped Vecchia GP in trust-region Bayesian optimization viaThompson sampling. On several test functions and on two reinforcement-learningproblems, our methods compared favorably to the state of the art.    ",2022/03/02,Machine Learning,14,
54,A Survey on Offline Reinforcement Learning Taxonomy Review and Open Problems,Rafael Figueiredo Prudencio Marcos R O A Maximo Esther Luna Colombini,Machine Learning (cs.LG); Artificial Intelligence (cs.AI); Machine Learning (stat.ML),"  With the widespread adoption of deep learning, reinforcement learning (RL)has experienced a dramatic increase in popularity, scaling to previouslyintractable problems, such as playing complex games from pixel observations,sustaining conversations with humans, and controlling robotic agents. However,there is still a wide range of domains inaccessible to RL due to the high costand danger of interacting with the environment. Offline RL is a paradigm thatlearns exclusively from static datasets of previously collected interactions,making it feasible to extract policies from large and diverse trainingdatasets. Effective offline RL algorithms have a much wider range ofapplications than online RL, being particularly appealing for real-worldapplications such as education, healthcare, and robotics. In this work, wepropose a unifying taxonomy to classify offline RL methods. Furthermore, weprovide a comprehensive review of the latest algorithmic breakthroughs in thefield, and a review of existing benchmarks' properties and shortcomings.Finally, we provide our perspective on open problems and propose futureresearch directions for this rapidly growing field.    ",2022/03/02,Machine Learning,44,
55,Neural Galerkin Scheme with Active Learning for HighDimensional Evolution Equations,Joan Bruna Benjamin Peherstorfer Eric VandenEijnden,Numerical Analysis (math.NA); Machine Learning (cs.LG); Machine Learning (stat.ML),"  Machine learning methods have been shown to give accurate predictions in highdimensions provided that sufficient training data are available. Yet, manyinteresting questions in science and engineering involve situations whereinitially no data are available and the principal aim is to gather insightsfrom a known model. Here we consider this problem in the context of systemswhose evolution can be described by partial differential equations (PDEs). Weuse deep learning to solve these equations by generating data on-the-fly whenand where they are needed, without prior information about the solution. Theproposed Neural Galerkin schemes derive nonlinear dynamical equations for thenetwork weights by minimization of the residual of the time derivative of thesolution, and solve these equations using standard integrators for initialvalue problems. The sequential learning of the weights over time allows foradaptive collection of new input data for residual estimation. This step usesimportance sampling informed by the current state of the solution, in contrastwith other machine learning methods for PDEs that optimize the networkparameters globally in time. This active form of data acquisition is essentialto enable the approximation power of the neural networks and to break the curseof dimensionality faced by non-adaptative learning strategies. Theapplicability of the method is illustrated on several numerical examplesinvolving high-dimensional PDEs, including advection equations with manyvariables, as well as Fokker-Planck equations for systems with severalinteracting particles.    ",2022/03/02,Machine Learning,76,
56,License Incompatibilities in Software Ecosystems,RolfHelge Pfeiffer,Software Engineering (cs.SE),"  Contemporary software is characterized by reuse of components that aredeclared as dependencies and that are received from packagemanagers/registries, such as, NPM, PyPI, RubyGems, Maven Central, etc. Directand indirect dependency relations often form opaque dependency networks, thatsometimes lead to conflicting software licenses within these. In this paper, westudy license use and license incompatibilities between all components fromseven package registries (Cargo, Maven, NPM, NuGet, Packagist, PyPI, RubyGems)with a closer investigation of license incompatibilities caused by the GNUAffero General Public License (AGPL). We find that the relative amount of usedlicenses vary between ecosystems (permissive licenses such as MIT and Apacheare most frequent), that the number of direct license incompatibilities rangesfrom low 2.3% in Cargo to a large 20.8% in PyPI, that only a low amount ofdirect license incompatibilities are caused by AGPL licenses (max. 0.04% inPyPI), but that a whopping 6.62% of Maven packages are violating the AGPLlicense of an indirect dependency. Our results suggest that it is not toounlikely that applications that are reusing packages from PyPI or Maven areconfronted with license incompatibilities that could mean that applicationswould have to be open-sourced on distribution (PyPI) or as soon as they arepublicly available as web-applications (Maven).    ",2022/03/03,Software Engineering,112,
57,Computation offloading to hardware accelerators in Intel SGX and Gramine Library OS,Dmitrii Kuvaiskii Gaurav Kumar Mona Vij,Cryptography and Security (cs.CR); Software Engineering (cs.SE),"  The Intel Software Guard Extensions (SGX) technology enables applications torun in an isolated SGX enclave environment, with elevated confidentiality andintegrity guarantees. Gramine Library OS facilitates execution of existingunmodified applications in SGX enclaves, requiring only an accompanyingmanifest file that describes the application's security posture andconfiguration. However, Intel SGX is a CPU-only technology, thus Graminecurrently supports CPU-only workloads. To enable a broader class ofapplications that offload computations to hardware accelerators - GPU offload,NIC offload, FPGA offload, TPM communications - Gramine must be augmented withdevice-backed mmap support and generic ioctl support. In this paper, wedescribe the design and implementation of this newly added support, thecorresponding changes to the manifest-file syntax and the requisite deep copyalgorithm. We evaluate our implementation on Intel Media SDK workloads anddiscuss the encountered caveats and limitations. Finally, we outline a use casefor the presented mmap/ioctl support beyond mere device communication, namelythe mechanism to slice the application into the trusted enclave part (where thecore application executes) and the untrusted shared-memory part (where insecureshared libraries execute).    ",2022/03/02,Software Engineering,27,
58,A Survey of Analysis Methods for Security and Safety verification in IoT Systems,Lobna Abuserrieh Manar H Alalfi,Cryptography and Security (cs.CR); Software Engineering (cs.SE),"  Internet of Things (IoT) has been rapidly growing in the past few years inall life disciplines. IoT provides automation and smart control to its users indifferent domains such as home automation, healthcare systems, automotive, andmany more. Given the tremendous number of connected IoT devices, this growthleads to enormous automatic interactions among sizeable IoT apps in theirenvironment, making IoT apps more intelligent and more enjoyable to theirusers. But some unforeseen interactions of IoT apps and any potential maliciousbehaviour can seriously cause insecure and unsafe consequences to its users,primarily non-experts, who lack the required knowledge regarding the potentialimpact of their IoT automation processes. In this paper, we study the problemof security and safety verification of IoT systems. We survey techniques thatutilize program analysis to verify IoT applications' security and safetyproperties. The study proposes a set of categorization and classificationattributes to enhance our understanding of the research landscape in thisdomain. Moreover, we discuss the main challenges considered in the surveyedwork and potential solutions that could be adopted to ensure the security andsafety of IoT systems.    ",2022/03/03,Software Engineering,148,
59,NeuRecover RegressionControlled Repair of Deep Neural Networks with Training History,Shogo Tokui Susumu Tokumoto Akihito Yoshii Fuyuki Ishikawa Takao Nakagawa Kazuki Munakata Shinji Kikuchi,Machine Learning (cs.LG); Neural and Evolutionary Computing (cs.NE); Software Engineering (cs.SE),"  Systematic techniques to improve quality of deep neural networks (DNNs) arecritical given the increasing demand for practical applications includingsafety-critical ones. The key challenge comes from the little controllabilityin updating DNNs. Retraining to fix some behavior often has a destructiveimpact on other behavior, causing regressions, i.e., the updated DNN fails withinputs correctly handled by the original one. This problem is crucial whenengineers are required to investigate failures in intensive assuranceactivities for safety or trust. Search-based repair techniques for DNNs havepotentials to tackle this challenge by enabling localized updates only on""responsible parameters"" inside the DNN. However, the potentials have not beenexplored to realize sufficient controllability to suppress regressions in DNNrepair tasks. In this paper, we propose a novel DNN repair method that makesuse of the training history for judging which DNN parameters should be changedor not to suppress regressions. We implemented the method into a tool calledNeuRecover and evaluated it with three datasets. Our method outperformed theexisting method by achieving often less than a quarter, even a tenth in somecases, number of regressions. Our method is especially effective when therepair requirements are tight to fix specific failure types. In such cases, ourmethod showed stably low rates (<2%) of regressions, which were in many cases atenth of regressions caused by retraining.    ",2022/03/01,Software Engineering,5,
60,Counterfactually Evaluating Explanations in Recommender Systems,Yuanshun Yao Chong Wang Hang Li,Artificial Intelligence (cs.AI),"  Modern recommender systems face an increasing need to explain theirrecommendations. Despite considerable progress in this area, evaluating thequality of explanations remains a significant challenge for researchers andpractitioners. Prior work mainly conducts human study to evaluate explanationquality, which is usually expensive, time-consuming, and prone to human bias.In this paper, we propose an offline evaluation method that can be computedwithout human involvement. To evaluate an explanation, our method quantifiesits counterfactual impact on the recommendation. To validate the effectivenessof our method, we carry out an online user study. We show that, compared toconventional methods, our method can produce evaluation scores more correlatedwith the real human judgments, and therefore can serve as a better proxy forhuman evaluation. In addition, we show that explanations with high evaluationscores are considered better by humans. Our findings highlight the promisingdirection of using the counterfactual approach as one possible way to evaluaterecommendation explanations.    ",2022/03/02,Artificial Intelligence,16,
61,Analytical Solutions for the Inverse Problem within Gradual Semantics,Nir Oren Bruno Yun Assaf Libman Murilo S Baptista,Artificial Intelligence (cs.AI),"  Gradual semantics within abstract argumentation associate a numeric scorewith every argument in a system, which represents the level of acceptability ofthis argument, and from which a preference ordering over arguments can bederived. While some semantics operate over standard argumentation frameworks,many utilise a weighted framework, where a numeric initial weight is associatedwith each argument. Recent work has examined the inverse problem within gradualsemantics. Rather than determining a preference ordering given an argumentationframework and a semantics, the inverse problem takes an argumentationframework, a gradual semantics, and a preference ordering as inputs, andidentifies what weights are needed to over arguments in the framework to obtainthe desired preference ordering. Existing work has attacked the inverse problemnumerically, using a root finding algorithm (the bisection method) to identifyappropriate initial weights. In this paper we demonstrate that for a class ofgradual semantics, an analytical approach can be used to solve the inverseproblem. Unlike the current state-of-the-art, such an analytic approach canrapidly find a solution, and is guaranteed to do so. In obtaining this result,we are able to prove several important properties which previous work had posedas conjectures.    ",2022/03/02,Artificial Intelligence,146,
62,Controlling the Focus of Pretrained Language Generation Models,Jiabao Ji Yoon Kim James Glass Tianxing He,Artificial Intelligence (cs.AI),"  The finetuning of pretrained transformer-based language generation models aretypically conducted in an end-to-end manner, where the model learns to attendto relevant parts of the input by itself. However, there does not exist amechanism to directly control the model's focus. This work aims to develop acontrol mechanism by which a user can select spans of context as ""highlights""for the model to focus on, and generate relevant output. To achieve this goal,we augment a pretrained model with trainable ""focus vectors"" that are directlyapplied to the model's embeddings, while the model itself is kept fixed. Thesevectors, trained on automatic annotations derived from attribution methods, actas indicators for context importance. We test our approach on two coregeneration tasks: dialogue response generation and abstractive summarization.We also collect evaluation data where the highlight-generation pairs areannotated by humans. Our experiments show that the trained focus vectors areeffective in steering the model to generate outputs that are relevant touser-selected highlights.    ",2022/03/02,Artificial Intelligence,22,
63,On the Configuration of More and Less Expressive Logic Programs,Carmine Dodaro Marco Maratea Mauro Vallati,Artificial Intelligence (cs.AI),"  The decoupling between the representation of a certain problem, i.e., itsknowledge model, and the reasoning side is one of main strong points ofmodel-based Artificial Intelligence (AI). This allows, e.g. to focus onimproving the reasoning side by having advantages on the whole solving process.Further, it is also well-known that many solvers are very sensitive to evensyntactic changes in the input. In this paper, we focus on improving thereasoning side by taking advantages of such sensitivity. We consider twowell-known model-based AI methodologies, SAT and ASP, define a number ofsyntactic features that may characterise their inputs, and use automatedconfiguration tools to reformulate the input formula or program. Results of awide experimental analysis involving SAT and ASP domains, taken from respectivecompetitions, show the different advantages that can be obtained by using inputreformulation and configuration. Under consideration in Theory and Practice ofLogic Programming (TPLP).    ",2022/03/02,Artificial Intelligence,140,
64,PKGM A Pretrained Knowledge Graph Model for Ecommerce Application,Wen Zhang ChiMan Wong Ganqinag Ye Bo Wen Hongting Zhou Wei Zhang Huajun Chen,Artificial Intelligence (cs.AI),"  In recent years, knowledge graphs have been widely applied as a uniform wayto organize data and have enhanced many tasks requiring knowledge. In onlineshopping platform Taobao, we built a billion-scale e-commerce product knowledgegraph. It organizes data uniformly and provides item knowledge services forvarious tasks such as item recommendation. Usually, such knowledge services areprovided through triple data, while this implementation includes (1) tediousdata selection works on product knowledge graph and (2) task model designingworks to infuse those triples knowledge. More importantly, product knowledgegraph is far from complete, resulting error propagation to knowledge enhancedtasks. To avoid these problems, we propose a Pre-trained Knowledge Graph Model(PKGM) for the billion-scale product knowledge graph. On the one hand, it couldprovide item knowledge services in a uniform way with service vectors forembedding-based and item-knowledge-related task models without accessing tripledata. On the other hand, it's service is provided based on implicitly completedproduct knowledge graph, overcoming the common the incomplete issue. We alsopropose two general ways to integrate the service vectors from PKGM intodownstream task models. We test PKGM in five knowledge-related tasks, itemclassification, item resolution, item recommendation, scene detection andsequential recommendation. Experimental results show that PKGM introducessignificant performance gains on these tasks, illustrating the useful ofservice vectors from PKGM.    ",2022/03/02,Artificial Intelligence,138,
65,NeuroSymbolic Verification of Deep Neural Networks,Xuan Xie Kristian Kersting Daniel Neider,Artificial Intelligence (cs.AI); Machine Learning (cs.LG); Logic in Computer Science (cs.LO),"  Formal verification has emerged as a powerful approach to ensure the safetyand reliability of deep neural networks. However, current verification toolsare limited to only a handful of properties that can be expressed asfirst-order constraints over the inputs and output of a network. Whileadversarial robustness and fairness fall under this category, many real-worldproperties (e.g., ""an autonomous vehicle has to stop in front of a stop sign"")remain outside the scope of existing verification technology. To mitigate thissevere practical restriction, we introduce a novel framework for verifyingneural networks, named neuro-symbolic verification. The key idea is to useneural networks as part of the otherwise logical specification, enabling theverification of a wide variety of complex, real-world properties, including theone above. Moreover, we demonstrate how neuro-symbolic verification can beimplemented on top of existing verification infrastructure for neural networks,making our framework easily accessible to researchers and practitioners alike.    ",2022/03/02,Artificial Intelligence,106,
66,ResponsibleAIbyDesign a Pattern Collection for Designing Responsible AI Systems,Qinghua Lu Liming Zhu Xiwei Xu Jon Whittle,Artificial Intelligence (cs.AI),"  Although AI has significant potential to transform society, there are seriousconcerns about its ability to behave and make decisions responsibly. Manyethical regulations, principles, and guidelines for responsible AI have beenissued recently. However, these principles are high-level and difficult to putinto practice. In the meantime much effort has been put into responsible AIfrom the algorithm perspective, but they are limited to a small subset ofethical principles amenable to mathematical analysis. Responsible AI issues gobeyond data and algorithms and are often at the system-level crosscutting manysystem components and the entire software engineering lifecycle. Based on theresult of a systematic literature review, this paper identifies one missingelement as the system-level guidance: how to design the architecture ofresponsible AI systems. We present a summary of design patterns that can beembedded into the AI systems as product features to contribute toresponsible-AI-by-design.    ",2022/03/02,Artificial Intelligence,142,
67,Computerization of Clinical Pathways A Literature Review and Directions for Future Research,Ayman Alahmar Ola Alkhatib,Artificial Intelligence (cs.AI),"  Clinical Pathways (CP) are medical management plans developed to standardizepatient treatment activities, optimize resource usage, reduce expenses, andimprove the quality of healthcare services. Most CPs currently in use arepaper-based documents (i.e., not computerized). CP computerization has been anactive research topic since the inception of CP use in hospitals. Thisliterature review research aims to examine studies that focused on CPcomputerization and offers recommendations for future research in thisimportant research area. Some critical research suggestions includecentralizing computerized CPs in Healthcare Information Systems (HIS), CP termstandardization using international medical terminology systems, developing aglobal CP-specific digital coding system, creating a unified CP meta-ontology,developing independent Clinical Pathway Management Systems (CPMS), andsupporting CPMSs with machine learning sub-systems.    ",2022/03/02,Artificial Intelligence,150,
68,HighMMT Towards Modality and Task Generalization for HighModality Representation Learning,Paul Pu Liang Yiwei Lyu Xiang Fan Shengtong Mo Dani Yogatama LouisPhilippe Morency Ruslan Salakhutdinov,Machine Learning (cs.LG); Artificial Intelligence (cs.AI); Computation and Language (cs.CL); Computer Vision and Pattern Recognition (cs.CV); Multimedia (cs.MM),"  Learning multimodal representations involves discovering correspondences andintegrating information from multiple heterogeneous sources of data. Whilerecent research has begun to explore the design of more general-purposemultimodal models (contrary to prior focus on domain and modality-specificarchitectures), these methods are still largely focused on a small set ofmodalities in the language, vision, and audio space. In order to accelerategeneralization towards diverse and understudied modalities, we investigatemethods for high-modality (a large set of diverse modalities) andpartially-observable (each task only defined on a small subset of modalities)scenarios. To tackle these challenges, we design a general multimodal modelthat enables multitask and transfer learning: multitask learning with sharedparameters enables stable parameter counts (addressing scalability), andcross-modal transfer learning enables information sharing across modalities andtasks (addressing partial observability). Our resulting model generalizesacross text, image, video, audio, time-series, sensors, tables, and setmodalities from different research areas, improves the tradeoff betweenperformance and efficiency, transfers to new modalities and tasks, and revealssurprising insights on the nature of information sharing in multitask models.We release our code and benchmarks which we hope will present a unifiedplatform for subsequent theoretical and empirical analysis:this https URL.    ",2022/03/02,Artificial Intelligence,135,
