paper_id,Title,Authors,Keyword,Abstract,Date,Field,Citations, 
69,DNDETR Accelerate DETR Training by Introducing Query DeNoising,Feng Li Hao Zhang Shilong Liu Jian Guo Lionel M Ni Lei Zhang,Computer Vision and Pattern Recognition (cs.CV); Artificial Intelligence (cs.AI),"  We present in this paper a novel denoising training method to speedup DETR(DEtection TRansformer) training and offer a deepened understanding of the slowconvergence issue of DETR-like methods. We show that the slow convergenceresults from the instability of bipartite graph matching which causesinconsistent optimization goals in early training stages. To address thisissue, except for the Hungarian loss, our method additionally feedsground-truth bounding boxes with noises into Transformer decoder and trains themodel to reconstruct the original boxes, which effectively reduces thebipartite graph matching difficulty and leads to a faster convergence. Ourmethod is universal and can be easily plugged into any DETR-like methods byadding dozens of lines of code to achieve a remarkable improvement. As aresult, our DN-DETR results in a remarkable improvement ($+1.9$AP) under thesame setting and achieves the best result (AP $43.4$ and $48.6$ with $12$ and$50$ epochs of training respectively) among DETR-like methods with ResNet-$50$backbone. Compared with the baseline under the same setting, DN-DETR achievescomparable performance with $50\%$ training epochs. Code is available at\url{this https URL}.    ",2022/03/02,Artificial Intelligence,147,
70,Pareto Frontier Approximation Network PANet to Solve Biobjective TSP,Ishaan Mehta Sajad Saeedi,Robotics (cs.RO); Artificial Intelligence (cs.AI),"  Travelling salesperson problem (TSP) is a classic resource allocation problemused to find an optimal order of doing a set of tasks while minimizing (ormaximizing) an associated objective function. It is widely used in robotics forapplications such as planning, scheduling etc. In this work, we solve TSP fortwo objectives using reinforcement learning. Often in multi objectiveoptimization problems, the associated objective functions can be conflicting innature. In such cases, the optimality is defined in terms of Pareto optimality.A set of these Pareto Optimal solutions in the objective space form a Paretofront (or frontier). Each solution has its own trade off. } In this work, wepresent PA-Net, a network that generates good approximations of the Paretofront for the bi-objective travelling salesperson problem (BTSP). Firstly, BTSPis converted into a constrained optimization problem. We then train our networkto solve this constrained problem using the Lagrangian relaxation and policygradient. With PA-Net we are able to generate good quality Pareto fronts withfast inference times. Finally, we present the application of PA-Net to findoptimal visiting order in a robotic navigation task/coverage planning.    ",2022/03/02,Artificial Intelligence,70,
71,Half Wavelet Attention on MNet for LowLight Image Enhancement,ChiMao Fan TsungJung Liu KuanHsien Liu,Image and Video Processing (eess.IV); Artificial Intelligence (cs.AI); Computer Vision and Pattern Recognition (cs.CV); Multimedia (cs.MM),"  Low-Light Image Enhancement is a computer vision task which intensifies thedark images to appropriate brightness. It can also be seen as an ill-posedproblem in image restoration domain. With the success of deep neural networks,the convolutional neural networks surpass the traditional algorithm-basedmethods and become the mainstream in the computer vision area. To advance theperformance of enhancement algorithms, we propose an image enhancement network(HWMNet) based on an improved hierarchical model: M-Net+. Specifically, we usea half wavelet attention block on M-Net+ to enrich the features from waveletdomain. Furthermore, our HWMNet has competitive performance results on twoimage enhancement datasets in terms of quantitative metrics and visual quality.The source code and pretrained model are available atthis https URL.    ",2022/03/02,Artificial Intelligence,54,
72,Providing Insights for OpenResponse Surveys via EndtoEnd ContextAware Clustering,Soheil Esmaeilzadeh Brian Williams Davood Shamsi Onar Vikingstad,Machine Learning (cs.LG); Artificial Intelligence (cs.AI); Computation and Language (cs.CL),"  Teachers often conduct surveys in order to collect data from a predefinedgroup of students to gain insights into topics of interest. When analyzingsurveys with open-ended textual responses, it is extremely time-consuming,labor-intensive, and difficult to manually process all the responses into aninsightful and comprehensive report. In the analysis step, traditionally, theteacher has to read each of the responses and decide on how to group them inorder to extract insightful information. Even though it is possible to groupthe responses only using certain keywords, such an approach would be limitedsince it not only fails to account for embedded contexts but also cannot detectpolysemous words or phrases and semantics that are not expressible in singlewords. In this work, we present a novel end-to-end context-aware framework thatextracts, aggregates, and abbreviates embedded semantic patterns inopen-response survey data. Our framework relies on a pre-trained naturallanguage model in order to encode the textual data into semantic vectors. Theencoded vectors then get clustered either into an optimally tuned number ofgroups or into a set of groups with pre-specified titles. In the former case,the clusters are then further analyzed to extract a representative set ofkeywords or summary sentences that serve as the labels of the clusters. In ourframework, for the designated clusters, we finally provide context-awarewordclouds that demonstrate the semantically prominent keywords within eachgroup. Honoring user privacy, we have successfully built the on-deviceimplementation of our framework suitable for real-time analysis on mobiledevices and have tested it on a synthetic dataset. Our framework reduces thecosts at-scale by automating the process of extracting the most insightfulinformation pieces from survey data.    ",2022/03/02,Artificial Intelligence,98,
73,The role of haptic communication in dyadic collaborative object manipulation tasks,Yiming Liu Raz Leib William Dudley Ali Shafti A Aldo Faisal David W Franklin,Robotics (cs.RO); Artificial Intelligence (cs.AI); Human-Computer Interaction (cs.HC),"  Intuitive and efficient physical human-robot collaboration relies on themutual observability of the human and the robot, i.e. the two entities beingable to interpret each other's intentions and actions. This is remedied by amyriad of methods involving human sensing or intention decoding, as well ashuman-robot turn-taking and sequential task planning. However, the physicalinteraction establishes a rich channel of communication through forces, torquesand haptics in general, which is often overlooked in industrial implementationsof human-robot interaction. In this work, we investigate the role of haptics inhuman collaborative physical tasks, to identify how to integrate physicalcommunication in human-robot teams. We present a task to balance a ball at atarget position on a board either bimanually by one participant, or dyadicallyby two participants, with and without haptic information. The task requiresthat the two sides coordinate with each other, in real-time, to balance theball at the target. We found that with training the completion time and numberof velocity peaks of the ball decreased, and that participants gradually becameconsistent in their braking strategy. Moreover we found that the presence ofhaptic information improved the performance (decreased completion time) and ledto an increase in overall cooperative movements. Overall, our results show thathumans can better coordinate with one another when haptic feedback isavailable. These results also highlight the likely importance of hapticcommunication in human-robot physical interaction, both as a tool to inferhuman intentions and to make the robot behaviour interpretable to humans.    ",2022/03/02,Artificial Intelligence,14,
74,Deep Temporal Interpolation of Radarbased Precipitation,Michiaki Tatsubori Takao Moriyama Tatsuya Ishikawa Paolo Fraccaro Anne Jones Blair Edwards Julian Kuehnert Sekou L Remy,Computer Vision and Pattern Recognition (cs.CV); Artificial Intelligence (cs.AI); Machine Learning (cs.LG),"  When providing the boundary conditions for hydrological flood models andestimating the associated risk, interpolating precipitation at very hightemporal resolutions (e.g. 5 minutes) is essential not to miss the cause offlooding in local regions. In this paper, we study optical flow-basedinterpolation of globally available weather radar images from satellites. Theproposed approach uses deep neural networks for the interpolation of multiplevideo frames, while terrain information is combined with temporarilycoarse-grained precipitation radar observation as inputs for self-supervisedtraining. An experiment with the Meteonet radar precipitation dataset for theflood risk simulation in Aude, a department in Southern France (2018),demonstrated the advantage of the proposed method over a linear interpolationbaseline, with up to 20% error reduction.    ",2022/03/01,Artificial Intelligence,109,
75,WaveYNet Physicsaugmented deep learning for highspeed electromagnetic simulation and optimization,Mingkun Chen Robert Lupoiu Chenkai Mao DerHan Huang Jiaqi Jiang Philippe Lalanne Jonathan A Fan,Applied Physics (physics.app-ph); Artificial Intelligence (cs.AI); Computational Physics (physics.comp-ph),"  The calculation of electromagnetic field distributions within structuredmedia is central to the optimization and validation of photonic devices. Weintroduce WaveY-Net, a hybrid data- and physics-augmented convolutional neuralnetwork that can predict electromagnetic field distributions with ultra fastspeeds and high accuracy for entire classes of dielectric photonic structures.This accuracy is achieved by training the neural network to learn only themagnetic near-field distributions of a system and to use a discrete formalismof Maxwell's equations in two ways: as physical constraints in the lossfunction and as a means to calculate the electric fields from the magneticfields. As a model system, we construct a surrogate simulator for periodicsilicon nanostructure arrays and show that the high speed simulator can bedirectly and effectively used in the local and global freeform optimization ofmetagratings. We anticipate that physics-augmented networks will serve as aviable Maxwell simulator replacement for many classes of photonic systems,transforming the way they are designed.    ",2022/03/02,Artificial Intelligence,77,
76,On the Optimization Landscape of Neural Collapse under MSE Loss Global Optimality with Unconstrained Features,Jinxin Zhou Xiao Li Tianyu Ding Chong You Qing Qu Zhihui Zhu,Machine Learning (cs.LG); Artificial Intelligence (cs.AI); Information Theory (cs.IT); Optimization and Control (math.OC); Machine Learning (stat.ML),"  When training deep neural networks for classification tasks, an intriguingempirical phenomenon has been widely observed in the last-layer classifiers andfeatures, where (i) the class means and the last-layer classifiers all collapseto the vertices of a Simplex Equiangular Tight Frame (ETF) up to scaling, and(ii) cross-example within-class variability of last-layer activations collapsesto zero. This phenomenon is called Neural Collapse (NC), which seems to takeplace regardless of the choice of loss functions. In this work, we justify NCunder the mean squared error (MSE) loss, where recent empirical evidence showsthat it performs comparably or even better than the de-facto cross-entropyloss. Under a simplified unconstrained feature model, we provide the firstglobal landscape analysis for vanilla nonconvex MSE loss and show that the(only!) global minimizers are neural collapse solutions, while all othercritical points are strict saddles whose Hessian exhibit negative curvaturedirections. Furthermore, we justify the usage of rescaled MSE loss by probingthe optimization landscape around the NC solutions, showing that the landscapecan be improved by tuning the rescaling hyperparameters. Finally, ourtheoretical findings are experimentally verified on practical networkarchitectures.    ",2022/03/02,Artificial Intelligence,145,
77,Audio Selfsupervised Learning A Survey,Shuo Liu Adria MallolRagolta Emilia ParadaCabeleiro Kun Qian Xin Jing Alexander Kathan Bin Hu Bjoern W Schuller,Sound (cs.SD); Artificial Intelligence (cs.AI); Audio and Speech Processing (eess.AS),"  Inspired by the humans' cognitive ability to generalise knowledge and skills,Self-Supervised Learning (SSL) targets at discovering general representationsfrom large-scale data without requiring human annotations, which is anexpensive and time consuming task. Its success in the fields of computer visionand natural language processing have prompted its recent adoption into thefield of audio and speech processing. Comprehensive reviews summarising theknowledge in audio SSL are currently missing. To fill this gap, in the presentwork, we provide an overview of the SSL methods used for audio and speechprocessing applications. Herein, we also summarise the empirical works thatexploit the audio modality in multi-modal SSL frameworks, and the existingsuitable benchmarks to evaluate the power of SSL in the computer auditiondomain. Finally, we discuss some open problems and point out the futuredirections on the development of audio SSL.    ",2022/03/02,Artificial Intelligence,60,
78,AvantSatie Using ERIK to encode taskrelevant expressivity into the animation of autonomous social robots,Tiago Ribeiro Ana Paiva,Robotics (cs.RO); Artificial Intelligence (cs.AI); Human-Computer Interaction (cs.HC),"  ERIK is an expressive inverse kinematics technique that has been previouslypresented and evaluated both algorithmically and in a limited user-interactionscenario. It allows autonomous social robots to convey posture-based expressiveinformation while gaze-tracking users. We have developed a new scenario aimedat further validating some of the unsupported claims from the previousscenario. Our experiment features a fully autonomous Adelino robot, andconcludes that ERIK can be used to direct a user's choice of actions duringexecution of a given task, fully through its non-verbal expressive queues.    ",2022/03/02,Artificial Intelligence,16,
79,Engineering the Neural Automatic Passenger Counter,Nico Jahn Michael Siebert,Machine Learning (cs.LG); Artificial Intelligence (cs.AI),"  Automatic passenger counting (APC) in public transportation has beenapproached with various machine learning and artificial intelligence methodssince its introduction in the 1970s. While equivalence testing is becoming morepopular than difference detection (Student's t-test), the former is much moredifficult to pass to ensure low user risk. On the other hand, recentdevelopments in artificial intelligence have led to algorithms that promisemuch higher counting quality (lower bias). However, gradient-based methods(including Deep Learning) have one limitation: they typically run into localoptima. In this work, we explore and exploit various aspects of machinelearning to increase reliability, performance, and counting quality. We performa grid search with several fundamental parameters: the selection and size ofthe training set, which is similar to cross-validation, and the initial networkweights and randomness during the training process. Using this experiment, weshow how aggregation techniques such as ensemble quantiles can reduce bias, andwe give an idea of the overall spread of the results. We utilize the testsuccess chance, a simulative metric based on the empirical distribution. Wealso employ a post-training Monte Carlo quantization approach and introducecumulative summation to turn counting into a stationary method and allowunbounded counts.    ",2022/03/02,Artificial Intelligence,69,
80,InsertionNet 20 Minimal Contact MultiStep Insertion Using Multimodal Multiview Sensory Input,Oren Spector Vladimir Tchuiev Dotan Di Castro,Robotics (cs.RO); Artificial Intelligence (cs.AI),"  We address the problem of devising the means for a robot to rapidly andsafely learn insertion skills with just a few human interventions and withouthand-crafted rewards or demonstrations. Our InsertionNet version 2.0 providesan improved technique to robustly cope with a wide range of use-cases featuringdifferent shapes, colors, initial poses, etc. In particular, we present aregression-based method based on multimodal input from stereo perception andforce, augmented with contrastive learning for the efficient learning ofvaluable features. In addition, we introduce a one-shot learning technique forinsertion, which relies on a relation network scheme to better exploit thecollected data and to support multi-step insertion tasks. Our method improveson the results obtained with the original InsertionNet, achieving an almostperfect score (above 97.5$\%$ on 200 trials) in 16 real-life insertion taskswhile minimizing the execution time and contact during insertion. We furtherdemonstrate our method's ability to tackle a real-life 3-step insertion taskand perfectly solve an unseen insertion task without learning.    ",2022/03/02,Artificial Intelligence,112,
81,ParameterEfficient MixtureofExperts Architecture for Pretrained Language Models,ZeFeng Gao Peiyu Liu Wayne Xin Zhao ZhongYi Lu JiRong Wen,Computation and Language (cs.CL); Artificial Intelligence (cs.AI); Machine Learning (cs.LG); Quantum Physics (quant-ph),"  The state-of-the-art Mixture-of-Experts (short as MoE) architecture hasachieved several remarkable successes in terms of increasing model capacity.However, MoE has been hindered widespread adoption due to complexity,communication costs, and training instability. Here we present a novel MoEarchitecture based on matrix product operators (MPO) from quantum many-bodyphysics. It can decompose an original matrix into central tensors (containingthe core information) and auxiliary tensors (with only a small proportion ofparameters). With the decomposed MPO structure, we can reduce the parameters ofthe original MoE architecture by sharing a global central tensor across expertsand keeping expert-specific auxiliary tensors. We also design the gradient maskstrategy for the tensor structure of MPO to alleviate the overfitting problem.Experiments on the three well-known downstream natural language datasets basedon GPT2 show improved performance and efficiency in increasing model capacity(7.26x fewer parameters with the same amount of experts). We additionallydemonstrate an improvement in the positive transfer effects of our approach formulti-task learning.    ",2022/03/02,Artificial Intelligence,96,
82,Visionbased Largescale 3D Semantic Mapping for Autonomous Driving Applications,Qing Cheng Niclas Zeller Daniel Cremers,Computer Vision and Pattern Recognition (cs.CV); Artificial Intelligence (cs.AI),"  In this paper, we present a complete pipeline for 3D semantic mapping solelybased on a stereo camera system. The pipeline comprises a direct sparse visualodometry front-end as well as a back-end for global optimization including GNSSintegration, and semantic 3D point cloud labeling. We propose a simple buteffective temporal voting scheme which improves the quality and consistency ofthe 3D point labels. Qualitative and quantitative evaluations of our pipelineare performed on the KITTI-360 dataset. The results show the effectiveness ofour proposed voting scheme and the capability of our pipeline for efficientlarge-scale 3D semantic mapping. The large-scale mapping capabilities of ourpipeline is furthermore demonstrated by presenting a very large-scale semanticmap covering 8000 km of roads generated from data collected by a fleet ofvehicles.    ",2022/03/02,Artificial Intelligence,122,
83,OnDevice Learning A Neural Network Based FieldTrainable Edge AI,Hiroki Matsutani Mineto Tsukada Masaaki Kondo,Machine Learning (cs.LG); Artificial Intelligence (cs.AI),"  In real-world edge AI applications, their accuracy is often affected byvarious environmental factors, such as noises, location/calibration of sensors,and time-related changes. This article introduces a neural network basedon-device learning approach to address this issue without going deep. Ourapproach is quite different from de facto backpropagation based training buttailored for low-end edge devices. This article introduces its algorithm andimplementation on a wireless sensor node consisting of Raspberry Pi Pico andlow-power wireless module. Experiments using vibration patterns of rotatingmachines demonstrate that retraining by the on-device learning significantlyimproves an anomaly detection accuracy at a noisy environment while savingcomputation and communication costs for low power.    ",2022/03/02,Artificial Intelligence,74,
84,Satellite Image and Machine Learning based Knowledge Extraction in the Poverty and Welfare Domain,Ola Hall Mattias Ohlsson Thortseinn Rögnvaldsson,Computers and Society (cs.CY); Artificial Intelligence (cs.AI); General Economics (econ.GN),"  Recent advances in artificial intelligence and machine learning have createda step change in how to measure human development indicators, in particularasset based poverty. The combination of satellite imagery and machine learninghas the capability to estimate poverty at a level similar to what is achievedwith workhorse methods such as face-to-face interviews and household surveys.An increasingly important issue beyond static estimations is whether thistechnology can contribute to scientific discovery and consequently newknowledge in the poverty and welfare domain. A foundation for achievingscientific insights is domain knowledge, which in turn translates intoexplainability and scientific consistency. We review the literature focusing onthree core elements relevant in this context: transparency, interpretability,and explainability and investigate how they relates to the poverty, machinelearning and satellite imagery nexus. Our review of the field shows that thestatus of the three core elements of explainable machine learning(transparency, interpretability and domain knowledge) is varied and does notcompletely fulfill the requirements set up for scientific insights anddiscoveries. We argue that explainability is essential to support widerdissemination and acceptance of this research, and explainability means morethan just interpretability.    ",2022/03/02,Artificial Intelligence,103,
85,Mobile device users susceptibility to phishing attacks,F Ley Sylvester,Cryptography and Security (cs.CR),"The mobile device is one of the fasted growing technologies that is widelyused in a diversifying sector. Mobile devices are used for everyday life, suchas personal information exchange - chatting, email, shopping, and mobilebanking, contributing to information security threats. Users' behavior caninfluence information security threats. More research is needed to understandusers' threat avoidance behavior and motivation. Using Technology threatavoidance theory (TTAT), this study assessed factors that influenced mobiledevice users' threat avoidance motivations and behaviors as it relates tophishing attacks. From the data collected from 137 mobile device users using aquestionnaire, the findings indicate that (1) mobile device users' perceivedsusceptibility and severity of phishing attacks have a significant correlationwith a users' perception of the threat; (2) mobile device users' motivation toavoid a threat is correlated to a users' behavior in avoiding threat; and (3) amobile device user's susceptibility to phishing attacks can be reduced by theirperception of the threat. These findings reveal that a user's perception ofthreat increases if they perceive that the consequence of such threat to theirmobile devices will be severe, thereby increasing a user's motivation andbehavior to avoid phishing attack threats. This study is beneficial to mobiledevice users in personal and organizational settings.",3/2/2022,Cryptography and Security,84,
86,Computation offloading to hardware accelerators in Intel SGX and Gramine Library OS,Dmitrii Kuvaiskii Gaurav Kumar Mona Vij,Cryptography and Security (cs.CR); Software Engineering (cs.SE),"The Intel Software Guard Extensions (SGX) technology enables applications torun in an isolated SGX enclave environment, with elevated confidentiality andintegrity guarantees. Gramine Library OS facilitates execution of existingunmodified applications in SGX enclaves, requiring only an accompanyingmanifest file that describes the application's security posture andconfiguration. However, Intel SGX is a CPU-only technology, thus Graminecurrently supports CPU-only workloads. To enable a broader class ofapplications that offload computations to hardware accelerators - GPU offload,NIC offload, FPGA offload, TPM communications - Gramine must be augmented withdevice-backed mmap support and generic ioctl support. In this paper, wedescribe the design and implementation of this newly added support, thecorresponding changes to the manifest-file syntax and the requisite deep copyalgorithm. We evaluate our implementation on Intel Media SDK workloads anddiscuss the encountered caveats and limitations. Finally, we outline a use casefor the presented mmap/ioctl support beyond mere device communication, namelythe mechanism to slice the application into the trusted enclave part (where thecore application executes) and the untrusted shared-memory part (where insecureshared libraries execute).",3/2/2022,Cryptography and Security,75,
